IBGE,NUMERO,UF,MUNICIPIO,CNES,NOME FANTASIA,RAZAO SOCIAL,LOGRADOURO,NUMERO_1,BAIRRO,CEP,LATITUDE,LONGITUDE
350050,1,SP,AGUAS DE LINDOIA,3853357,PSF III DR JOSE EGIDIO DE ALVARENGA AGUAS DE LINDOIA,PREFEITURA MUNICIPAL DE AGUAS DE LINDOIA,M,AVENIDA DAS NACOES UNIDAS,1100,CENTRO,,
351380,2,SP,DIADEMA,3853594,SONIA REGINA DE SOUZA LAPA,SONIA REGINA DE SOUZA LAPA,AVENIDA JOSE BONIFACIO,838,JD SERRARIA,9960120,,
354990,3,SP,SAO JOSE DOS CAMPOS,3854132,CARMEN CRISTINA PONTES DE MORAIS HUNGRIA,HUNGRIA SERVICOS MEDICOS LTDA,,M,PAULO SETUBAL,147,,
354990,4,SP,SAO JOSE DOS CAMPOS,3854183,ROSEMEIRE APARECIDA FACIOLI,ROSEMEIRE APARECIDA FACIOLI,RUA SANTA LUZIA,106,JD NOVA AMERICA,12242580,,
354340,5,SP,RIBEIRAO PRETO,5015839,IMPLAMARK RIBEIRAO PRETO,IMPLAMARK IMPLANTES ODONTOLOGICOS EIRELI,,M,TAPAJOS,1851,,
354340,6,SP,RIBEIRAO PRETO,5015936,PICOLLI CLINICA PEDIATRICA,PICOLLI CLINICA PEDIATRICA S S,,M,AV JOSE ADOLFO BIANCO MOLINA,2271,,
355030,7,SP,SAO PAULO,5015944,INST COHEN DE ORTOP REABILITACAO E MEDICINA DO ESPORTE,INSTITUTO COHEN DE ORTOPEDIA REABILITACAO E MEDIC DO ESPORTE,,M,AVENIDA LINEU DE PAULA MACHADO,660,,
355030,8,SP,SAO PAULO,5015979,CLINICA ESPEC GIAN MARCO LIBANO,GIANMARCO LIBANO,RUA MATO GROSSO,306,HIGIENOPOLIS,1237040,,
355030,9,SP,SAO PAULO,5016002,CONS MEDICO ROBERTO FRANCESCHELLI FILHO,ROBERTO FRANCESCHELLI FILHO,RUA TEODORO SAMPAIO,744,PINHEIROS,3279060,,
355030,10,SP,SAO PAULO,5016045,CLINOB CLINICA OBSTETRICA,CLINOB CLINICA OBSTETRICA SC LTDA,,M,RUA DOMINGOS RODRIGUES,341,,
354390,11,SP,RIO CLARO,5016088,CONSULTORIO DE PSICOLOGIA,NORMA MISSONO CECCATO,RUA 9,3229,ALTO DO SANTANA,13504191,407349257,-739231109
354850,12,SP,SANTOS,5016290,FRANCISCO CARLOS MORAES DOS SANTOS,FRANCISCO CARLOS MORAES DOS SANTOS,AVENIDA DOUTOR PEDRO LESSA,523,PONTA DA PRAIA,11025001,,
354340,13,SP,RIBEIRAO PRETO,5016991,INSTITUTO ONCOLOGICO DE RIBEIRAO PRETO,INSTITUTO ONCOLOGICO DE RIBEIRAO PRETO LTDA,,M,RUA AYRTON ROXO,571,,
354880,14,SP,SAO CAETANO DO SUL,5017092,CLINICA MEDICA ANITA G BOLOGNANI LTDA,CLINICA MEDICA ANITA G BOLOGNANI LTDA,RUA HERCULANO DE FREITAS,295,FUNDACAO,9520280,,
351350,15,SP,CUBATAO,5017114,NICIA COSTA RIBEIRO,NICIA COSTA RIBEIRO,RUA 1 DE MAIO,55,VILA NOVA,11520130,,
351350,16,SP,CUBATAO,5017149,MARIA RITA BRUDER COSTA,MARIA RITA BRUDER COSTA,RUA 1 DE MAIO,55,VILA NOVA,11520130,,
355400,17,SP,TATUI,5017432,EDVALDO CANDIDO DE OLIVEIRA,EDVALDO CANDIDO DE OLIVEIRA,AV CEL FIRMO VIEIRA DE CAMARGO,782,CENTRO,18270770,,
355400,18,SP,TATUI,5017440,PROTESE DENTARIA PAULO ROBERTO AMADEI TATUI SP,PAULO ROBERTO AMADEI ME,,M,RUA CAPITAO LISBOA,715,4080777,-7394549
353950,19,SP,PITANGUEIRAS,5017637,MARCELO FERREIRA GOMES ODONTOLOGIA PITANGUEIRAS,MARCELO FERREIRA GOMES,RUA GETULIO VARGAS,12,CENTRO,14750000,,
352480,20,SP,JALES,5017718,ASSUNCAO AZEVEDO,ASSUNCAO AZEVEDO S S LTDA,,M,RUA 14,2131,,
350060,21,SP,AGUAS DE SAO PEDRO,7072244,CARDIOTEST DE AGUAS DE SAP PEDRO,CARDIOTEST DE AGUAS DE SAO PEDRO S S LTDA,,M,PRACA DOS ROUXINOIS,360,,
350160,22,SP,AMERICANA,7080247,TEREZINHA APARECIDA GALASSI ANTONIO,TEREZINHA APARECIDA GALASSI ANTONIO,RUA DAS ACACIAS,133,JD SAO PAULO,13468150,,
350600,23,SP,BAURU,7084579,ERIKA PIMENTEL LOBO ASSUMPCAO,ERIKA PIMENTEL LOBO ASSUMPCAO,RUA RIO BRANCO,1383,CENTRO,17015311,,
355160,24,SP,SERRA NEGRA,5017734,CAPS DE SERRA NEGRA,PREFEITURA MUNICIPAL DA ESTANCIA HIDROMINERAL DE SERRA NEGRA,M,AVENIDA JOAO GEROSA,1855,DOS FRANCOS,40895195,-7388012
355710,25,SP,VOTUPORANGA,5017742,CONS ISOL DRA ADRIANA GUERCHE GIBIM VOTUPORANGA,ADRIANA GUERCHE GIBIM,R TIETE,3068,SANTA ELISA,15505186,,
354340,26,SP,RIBEIRAO PRETO,5018102,FABIANE LEONI COUTO ROSA BERGAMO,FABIANE LEONI COUTO ROSA BERGAMO,RUA JOAO ARCADEPANI FILHO,278,NOVA RIBEIRANIA,14096720,,
355030,27,SP,SAO PAULO,5018234,CONS MEDICO UBIRATAN MENDONCA,DR UBIRATAN MENDONCA JR CIRURGIA GASTRO E PROTOCTOLOGIA LTDA,M,RUA CINCINATO BRAGA,59,BELA VISTA,,
354910,28,SP,SAO JOAO DA BOA VISTA,5019133,FERNANDO ESTEVES ROCHA SAO JOAO DA BOA VISTA,FERNANDO ESTEVES ROCHA,RUA HENRIQUE CABRAL DE VASCONCELOS,1458,JD SAO NICOLAU,13876100,,
354910,29,SP,SAO JOAO DA BOA VISTA,5019176,JOAO MARCOS PEREIRA SAO JOAO DA BOA VISTA,JOAO MARCOS PEREIRA,AV DONA GERTRUDES,64,CENTRO,13870110,,
354910,30,SP,SAO JOAO DA BOA VISTA,5019184,JOSE WILSON GADELHA DE OLIVEIRA SAO JOAO DA BOA VISTA,JOSE WILSON GADELHA DE OLIVEIRA,RUA BENEDITO ARAUJO,476,CENTRO,13870090,,
354910,31,SP,SAO JOAO DA BOA VISTA,5019192,KARLA MARIA MAGALHAES TEIXEIRA SAVOI SAO JOAO DA BOA VISTA,KARLA MARIA MAGALHAES TEIXEIRA SAVOI,AV DURVAL NICOLAU,1307,JD RECANTO DO BOSQUE,13874422,,
354910,32,SP,SAO JOAO DA BOA VISTA,5019214,LUCIO DOVAL SAO JOAO DA BOA VISTA,LUCIO DOVAL,RUA 14 DE JULHO,1097,VILA CONRADO,13870742,40833736,-7388881
354850,33,SP,SANTOS,5019656,RAFAELA SAPAG DAGUAR,RAFAELA SAPAG DAGUAR,RUA AZEVEDO SODRE,121,GONZAGA,11055051,,
352430,34,SP,JABOTICABAL,5019699,ALOISIO TITO ROSA EIRELI EPP,ALOISIO TITO ROSA EIRELI EPP,,M,R DOUTOR MARIO DE CAMPOS,601,,
350610,35,SP,BEBEDOURO,5019885,PAPS PEDIATRAS,PAPS PEDIATRAS ASSOCIADOS LTDA,,M,AVENIDA RAUL FURQUIM,623,,
351110,36,SP,CATANDUVA,5019974,CLINICA SAO GABRIEL S C LTDA CATANDUVA,CLINICA SAO GABRIEL S C LTDA,,M,RUA TREZE DE MAIO,12691,,
352410,37,SP,ITUVERAVA,5020166,PSF JOSE YAMADA VILA SAO JORGE,PREFEITURA MUNICIPAL DE ITUVERAVA,M,ANDRE GOMES DO NASCIMENTO,1195,PARQUE DOS ESPORTES,,
354850,38,SP,SANTOS,5020301,CLIOS CLINICA OFTALMOLOGICA S S LTDA EPP,CLIOS CLINICA OFTALMOLOGICA S S LTDA EPP,M,RUA FIRMINO BARBOSA,155,BOQUEIRAO,,
355240,39,SP,SUMARE,5020565,CAPS II ORQUIDEA SUMARE,PREFEITURA MUNICIPAL DE SUMARE,M,RUA PADRE MIGUEL GUILHERME,235,CHACARA BELA VISTA,,
351040,40,SP,CAPIVARI,5020700,HELIO UTIMURA CAPIVARI,HELIO UTIMURA,RUA GENERAL OSORIO,35,CENTRO,13360000,,
351040,41,SP,CAPIVARI,5020719,SHEILA F PETINARI CAPIVARI,SHEILA F PETINARI,RUA GENERAL OSORIO,35,CENTRO,13360000,,
354390,42,SP,RIO CLARO,5020840,CLINICA BRANCO PSICOLOGIA,LUIZ GUSTAVO RODRIGUES BRANCO,RUA 4,685,CENTRO,13500030,,
351640,43,SP,FRANCO DA ROCHA,5021049,CIMF DIAGNOSTICO POR IMAGEM,CIMF RADIODIAGNOSTICO LTDA ME,,M,RUA CEL DOMINGOS ORTIZ,108,4066919,-738857
354850,44,SP,SANTOS,5021189,PAULO ROBERTO BARBOSA MARASCA,PAULO ROBERTO BARBOSA MARASCA,AVENIDA DOUTOR EPITACIO PESSOA,686,PONTA DA PRAIA,11030602,,
352670,45,SP,LEME,5021359,RITA DE CASSIA TIBURCIO FELIZATTI LEME,RITA DE CASSIA TIBURCIO FELIZATTI,RUA JOAQUIM MOURAO,814,CENTRO,13610050,,
350400,46,SP,ASSIS,5022169,CLINICA DE FISIOTERAPIA,ELIANA GENOVESE VICENTE PEREZ ME,,M,ROBERTO CASTELA,273,4073283,-7397415
352710,47,SP,LINS,5022207,CLINICA DE FISIOTERAPIA BEM ESTAR DE LINS,CLINICA DE FISIOTERAPIA BEM ESTAR DE LINS LTDA,M,RUA PEDRO DE TOLEDO,603,CENTRO,,
350330,48,SP,ARARAS,5022460,ICA INSTITUTO DO CORACAO DE ARARAS,I C A INSTITUTO DO CORACAO DE ARARAS S S,M,RUA AMERICA,137,CENTRO,,
355710,49,SP,VOTUPORANGA,5022592,CONS DE PSICOLOGIA KAMYLA MYCHELLI T SEBA VOTUPORANGA,KAMYLA MYCHELLI TORRES SEBA,RUA PERNAMBUCO,3880,PATRIMONIO VELHO,15500006,,
355030,50,SP,SAO PAULO,5022738,CLINICA DERMATOLOGICA NILTON DI CHIACCHIO,CLINICA DERMATOLOGICA NILTON DI CHIACCHIO SC LTDA,,M,RUA DR CESAR,62,40830048,-7390632
350530,51,SP,BARRA BONITA,5022800,CONSULTORIO MEDICO JOARA DE C PERACOLI IAIA BARRA BONITA,JOARA DE CASSIA PERACOLI IAIA,RUA RIO BRANCO,333,CENTRO,17340000,,
350760,52,SP,BRAGANCA PAULISTA,5022843,ADRIANO FRANCO DE OLIVEIRA,ADRIANO FRANCO DE OLIVEIRA,RUA CEL JOAO LEME,304,CENTRO,12900161,40792263,-7379332
354770,53,SP,SANTO ANASTACIO,3909328,CONSULTORIO MEDICO DR SICERLEY CASADO,CONSULTORIO MEDICO DR SICERLEY CASADO,RUA RUI BARBOSA,737,CENTRO,19360000,,
351550,54,SP,FERNANDOPOLIS,3909344,MEDICINA E CIRURGIA SERVICOS MEDICOS LTDA,MEDICINA E CIRURGIA SERVICOS MEDICOS LTDA,,M,AFONSO CAFARO,2010,,
355030,55,SP,SAO PAULO,3909484,CONS MEDICO ALBERTO,CLINICA OFTALMOLOGICA BROOKLIN LTDA,M,RUA JOAQUIM NABUCO,156,BROOKLIN,,
354330,56,SP,RIBEIRAO PIRES,3848361,VIVER COM SAUDE CLINICA MEDICA S C LTDA,VIVER COM SAUDE CLINICA MEDICA S C LTDA,,M,RUA KAETH RICHERS,37,,
352930,57,SP,MATAO,3848434,CLIMED MATAO,CLIMED SERVICOS MEDICOS LTDA,,M,RUA AFONSO MACCAGNAN,937,,
352930,58,SP,MATAO,3848442,LABORATORIO SAO FRANCISCO MATAO,LABORATORIO SAO FRANCISCO ANALISES CLINICAS LTDA,,M,RUA SINHARINHA FROTA,969,408264543,-738553285
355030,59,SP,SAO PAULO,3934535,CECCO DE PERUS,PREFEITURA DO MUNICIPIO DE SAO PAULO,M,RUA FIORELLI PECCIACCO,500,PERUS,,
350570,60,SP,BARUERI,3935388,GILBERTO AMBROGINI,GILBERTO AMBROGINI,AVENIDA CAMPOS SALES,303,CENTRO,6411150,,
354100,61,SP,PRAIA GRANDE,3935558,RUY MACHADO LIMA,RUY MACHADO LIMA,AV SAO PAULO,903,GUILHERMINA,11713310,40736732,-7385451
354850,62,SP,SANTOS,3935604,AURORA DIAGNOSTICO EM OUVIDOS NARIZ E GARGANTA LTDA,AURORA DIAGNOSTICO EM OUVIDOS NARIZ E GARGANTA LTDA,,M,AVENIDA DONA ANA COSTA,151,,
354990,63,SP,SAO JOSE DOS CAMPOS,3935892,CECAE,CECAE CENTRO DE CONVIVIO ATEND ESP LTDA,,M,AVENIDA CIDADE JARDIM,1780,,
355410,64,SP,TAUBATE,3936139,DERMATOLOGIA BONATO TAUBATE,MARILEI LOPES BONATO,AV ARMANDO SALLES OLIVEIRA,477,CENTRO,12030080,,
355410,65,SP,TAUBATE,3936147,CONSULTORIO DRA CARLA TAUBATE,CARLA PEROZINI ROSSI DO CARMO,RUA CARLOS RIZZINI,17,CENTRO,12030140,,
355410,66,SP,TAUBATE,3936163,CONSULTORIO ODONT JOSE ROBERTO MONTEIRO TAUBATE,JOSE ROBERTO MONTEIRO,PRACA SANTA TEREZINHA,15,CENTRO,12010130,,
352710,67,SP,LINS,3936171,VIVIANE TAIAR,VIVIANE TAIAR,RUA FLORIANO PEIXOTO,892,CENTRO,16400101,,
352710,68,SP,LINS,3936236,KELY BASTOS YAMAMOTO,KELY BASTOS YAMAMOTO,R WILSON LIMA,410,PASETTO,16403320,,
352710,69,SP,LINS,3936244,JOSE HENRIQUE SOZO,JOSE HENRIQUE SOZO,RUA PRINCESA ISABEL,91,CENTRO,16400225,,
352710,70,SP,LINS,3936260,BEATRIZ KAKAZU SATO,BEATRIZ KAKAZU SATO,RUA 9 DE JULHO,1456,VILA ALTA,16400111,,
354980,71,SP,SAO JOSE DO RIO PRETO,3936279,SERVICO DE ATENDIMENTO MOVEL DE URGENCIA,PREFEITURA MUNICIPAL DE SAO JOSE DO RIO PRETO,M,RUA PEDRO GOES,S/N,VILA ITALIA,,
352710,72,SP,LINS,3936287,ANDREA NOGUEIRA NORONHA MALDONADO,ANDREA NOGUEIRA NORONHA MALDONADO,RUA PEDRO DE TOLEDO,1177,CENTRO,16400106,,
352710,73,SP,LINS,3936317,RENATA MOYA MARTELLI,RENATA MOYA MARTELLI,RUA PEDRO DE TOLEDO,167,CENTRO,16400105,,
352710,74,SP,LINS,3936325,MARIA DONIZETTI DOMINGOS FUMIO,MARIA DONIZETTI DOMINGOS FUMIO,RUA LUIZ GAMA,690,CENTRO,16400080,40875122,-73905174
352710,75,SP,LINS,3936341,TOSHIRO TANJI,TOSHIRO TANJI,RUA DOM BOSCO,23,CENTRO,16400505,,
352710,76,SP,LINS,3936368,DORIANA RATTO GELIS FITTIPALDI,DORIANA RATTO GELIS FITTIPALDI,AVENIDA JOSE ARIANO RODRIGUES,549,JARDIM ARIANO,16400400,,
350600,77,SP,BAURU,7084471,IES,IES INSTITUTO DE ESPECIALIDADE EM SAUDE ODONTOLOGICALTDAEPP,,M,RUA ANTONIO XAVIER DE MENDONCA,58,,
350600,78,SP,BAURU,7084609,GUSTAVO HIDEKI KAWANAMI,GUSTAVO HIDEKI KAWANAMI,RUA CAPITAO JOAO ANTONIO,481,CENTRO,17015410,,
350600,79,SP,BAURU,7084455,ENFACE CLINICA DE PSICOLOGIA LTDA,ENFACE CLINICA DE PSICOLOGIA LTDA,M,ANTONIO ALVES,3575,VILA AEROPORTO,40693604,-738229
351050,80,SP,CARAGUATATUBA,7079753,AMBULATORIO DE SAUDE MENTAL CARAGUATATUBA,PREFEITURA MUNICIPAL DE CARAGUATATUBA,M,AVENIDA RIO DE JANEIRO,396,JARDIM PRIMAVERA,,
353730,81,SP,PENAPOLIS,5039444,PAULO FRANCISCO DE MESQUITA BARROS,PAULO FRANCISCO DE MESQUITA BARROS,RUA SANTA CLARA,481,CENTRO,16300047,,
354340,82,SP,RIBEIRAO PRETO,5039576,CLINICA MUNIR MIGUEL JACOB RIBEIRAO PRETO,CLINICA MUNIR MIGUEL JACOB EIRELI,,M,BERNARDINO DE CAMPOS,1609,,
355030,83,SP,SAO PAULO,5040035,CLINICA DE ESPEC CIRURGIA,CLINICA DE ESPECIALIDADES CIRURGICAS LTDA,,M,R MAESTRO CARDIM,377,40809563,-7392923
355030,84,SP,SAO PAULO,5040280,CENTRO ESP RADIOL ORTODONTIA ZAMBON,CENTRO ESP RADIOL ORTODONTIA ZAMBON SC LTDA,,M,RUA ANTONIO DA FONSECA,69,,
354990,85,SP,SAO JOSE DOS CAMPOS,5040310,3MR CLINICA DE PSICOLOGIA,3MR CLINICA DE PSICOLOGIA LTDA,,M,DOUTOR ADHEMAR DE BARROS,566,,
352220,86,SP,ITAPECERICA DA SERRA,5040426,CAPS AD DRA MARIA JOSE DE ALBUQUERQUE,SAUDE IS,M,RUA ARARAQUARA,208,JD EMBU MIRIM,40728207,-7373817
355100,87,SP,SAO VICENTE,3330060,CELSO DA SILVA NORONHA SAO VICENTE,CELSO DA SILVA NORONHA,RUA FREI GASPAR,739,CENTRO,11320120,,
355100,88,SP,SAO VICENTE,3330508,ROGERIA RITA DE CASSIA PALMA SAO VICENTE,ROGERIA RITA DE CASSIA PALMA,,M,RUA FREI GASPAR,739,,
352260,89,SP,ITAPIRA,3331040,ESMIR FESAL SABBAG,ESMIR FESAL SABBAG,RUA RUI BARBOSA,408,CENTRO,13974340,,
354980,90,SP,SAO JOSE DO RIO PRETO,3331660,MED CLINICA,MED CLINICA RIO PRETO LTDA,,M,RUA LUCAS MANGINI,443,,
354980,91,SP,SAO JOSE DO RIO PRETO,3331679,FISIOCENTER RICARDI,INSTITUTO DE FISIOTERAPIA RICARDI LTDA,,M,AV JUSCELINO KUBITSCHEK DE OLIVEIRA,1765,,
354850,92,SP,SANTOS,3332705,GILBERTO MARTINS GUIMARAES,GILBERTO MARTINS GUIMARAES,AVENIDA DOUTOR BERNARDINO DE CAMPOS,562,JOSE MENINO,11065001,40705135,-7390293
354670,93,SP,SANTA GERTRUDES,3334953,MARCELO CONS ISOLADO,MARCELO GARDENAL EPIPHANIO,AV 4,236,CENTRO,13510000,,
355030,94,SP,SAO PAULO,3335070,SUPERVISAO TECNICA DE SAUDE BUTANTA,PREFEITURA DO MUNICIPIO DE SAO PAULO,M,AV CORIFEU DE AZEVEDO MARQUES,3596,VILA BUTANTA,,
355030,95,SP,SAO PAULO,3335445,SUPERVISAO TECNICA DE SAUDE VILA PRUDENTE SAPOPEMBA,PREFEITURA DO MUNICIPIO DE SAO PAULO,M,PRACA CENTENARIO DE VILA PRUDENTE,108,VILA PRUDENTE,,
352710,96,SP,LINS,3337197,CLINICA DE ORTOPEDIA DR PAULO MEDRADO,CLINICA DE ORTOPEDIA E TRAUMATOLOGIA MEDRADO SC LTDA,,M,RUA RIO BRANCO,615,40580376,-73983315
353340,97,SP,NOVA ODESSA,3885305,GERALDO DIMAS GIANINI,GERALDO DIMAS GIANINI,RUA RIO BRANCO,281,CENTRO,13380003,,
351550,98,SP,FERNANDOPOLIS,7083297,PRISCILA DE ANDRADE FERNANDOPOLIS,PRISCILA DE ANDRADE PSICOLOGIA ME,,M,RUA EURIPEDES JOSE FERREIRA,652,40786785,-7380971
351550,99,SP,FERNANDOPOLIS,7083289,DROGARIA BRASILANDIA FERNANDOPOLIS,GILMAR MARCHIORI E CIA LTDA ME,,M,RUA GUILHERME BIM,489,4077006,-7390679
352570,100,SP,JOSE BONIFACIO,7084366,GARCIA GARCIA SERVICOS MEDICOS LTDA,GARCIA GARCIA SERVICOS MEDICOS LTDA,,M,AVENIDA CAMPOS SALES,1431,,
352590,101,SP,JUNDIAI,7084684,SANTA RITA CLINICA PEDIATRICA,SANTA RITA CLINICA PEDIATRICA LTDA,M,RUA RANGEL PESTANA,613,CENTRO,407925199,-739343547
355070,102,SP,SAO SEBASTIAO,7083378,ANDRE ABELLA MALUF,ANDRE ABELLA MALUF,AVENIDA PROFESSOR JOSE MACHADO ROSA,763,ITATINGA,11611139,40668247,-738873
355030,103,SP,SAO PAULO,3885429,CONS MEDICO LUIS MARCIO DOMINGUES ARANHA FILHO,LUIS MARCIO DOMINGUES ARANHA FILHO,AV ALFONSO BOVERO,1057,PERDIZES,5019011,,
355030,104,SP,SAO PAULO,3885437,CONS MEDICO GINEVIEW,GINEVIEW VIDEO ENDOSCOPIA GINECOLOGIA SS LTDA,M,RUA DR ALBUQUERQUE LINS,635,SANTA CECILIA,,
352440,105,SP,JACAREI,3923983,SOL SAUDE OCUPACAO E LAZER,SOL SERVICOS MEDICOS E DE SAUDE LTDA,M,RUA JOSE BONIFACIO,105,CENTRO,,
352440,106,SP,JACAREI,3923991,ORTOCLINICA EDSON LEMES DE SOUZA,ORTOCLINICA EDSON LEMES DE SOUZA,M,RUA PRUDENTE DE MORAES,52,CENTRO,,
352440,107,SP,JACAREI,3924009,PATRICIA MAURA FAGA,PATRICIA MAURA FAGA,RUA MINAS GERAIS,303,VILA PINHEIRO,12307060,407965332,-739759553
352440,108,SP,JACAREI,3924025,RODOLFO JORGE SOBRINHO,RODOLFO JORGE SOBRINHO,AV NOVE DE JULHO,520,CENTRO,12327682,,
352590,109,SP,JUNDIAI,3924041,CONSULTORIO ODONTOLOGICO SATURNINO APARECIDO RAMALHO,SATURNINO APARECIDO RAMALHO,RUA MARIO BORIN,500,CHACARA URBANA,13209030,40701214,-7380158
352590,110,SP,JUNDIAI,3924165,CONSULTORIO MEDICO CLAUDIO DE MATTOS,CLAUDIO DE MATTOS,RUA DO RETIRO,424,ANHANGABAU,13209000,,
354990,111,SP,SAO JOSE DOS CAMPOS,3924238,CARLOS EXPEDITO BENTO LEITAO,CARLOS EXPEDITO BENTO LEITAO,AVENIDA ADHEMAR DE BARROS,566,VILA ADYANNA,12245011,40608757,-74038086
354990,112,SP,SAO JOSE DOS CAMPOS,3924246,RC ALMEIDA CLINICA FOCUS DE RADIOLOGIA ODONTOLOGICA,RC ALMEIDA SERVICOS DE RADIOLOGIA LTDA,,M,RUA ENGENHEIRO PRUDENTE MEIRELLES DE MORAIS,787,,
352590,113,SP,JUNDIAI,3924254,CONSULTORIO MEDICO MARCO ANTONIO HERCULANO,MARCO ANTONIO HERCULANO,RUA DO RETIRO,424,ANHANGABAU,13209000,40707214,-74002754
352590,114,SP,JUNDIAI,3924297,LAB ANCHIETA UNIDADE ANCHIETA POSTO DE COLETA,LABORATORIO DE ANALISES CLINICAS ANCHIETA LTDA EPP,,M,RUA ANCHIETA,341,,
353130,115,SP,MONTE ALTO,3924386,SERVICOS MEDICOS MONTMED MONTE ALTO,SERVICOS MEDICOS MONTMED LTDA,,M,RUA JEREMIAS DE PAULA EDUARDO,2071,,
354340,116,SP,RIBEIRAO PRETO,3924394,RODRIGO SCANDIUZZI,RODRIGO SCANDIUZZI,RUA AMAZONAS,669,CAMPOS ELISEOS,14080270,,
354390,117,SP,RIO CLARO,3924408,LINGTAI,LINGTAI FISIOTERAPIA E CONSULTORIA S S LTDA,,M,RUA 7 CJ,203,4067538,-739082
352430,118,SP,JABOTICABAL,3924475,FABIO PETROUCIC,FABIO PETROUCIC,RUA BARAO DO RIO BRANCO,773,CENTRO,14870330,,
354340,119,SP,RIBEIRAO PRETO,3924599,KARINA FRANCELINO VENDRAMINI SCANDIUZZI,KARINA FRANCELINO VENDRAMINI SCANDIUZZI,RUA AMAZONAS,669,CAMPOS ELISEOS,14080270,,
350950,120,SP,CAMPINAS,3924610,LUCIANO FREIRE,LUCIANO FREIRE,AV ANDRADE NEVES,707,BOTAFOGO,13013161,407374593,-737410827
352710,121,SP,LINS,3924629,LESSANDRA DA SILVA TEIXEIRA,LESSANDRA DA SILVA TEIXEIRA,AV WILSON LIMA,410,PASETTO,16403340,,
352440,122,SP,JACAREI,3924637,ROSANA MARA FAGA,ROSANA MARA FAGA,RUA MINAS GERAIS,303,VILA PINHEIRO,12307060,,
352440,123,SP,JACAREI,3924769,SIDNEY BANDEIRA CARTAXO,SIDNEY BANDEIRA CARTAXO,RUA TREZE DE MAIO,51,CENTRO,12327220,,
354340,124,SP,RIBEIRAO PRETO,3924831,CLINICA FRANKLIN ALMEIDA,CLINICA FRANKLIN ALMEIDA LTDA,,M,GONCALVES DIAS,336,,
352710,125,SP,LINS,3924874,DANIEL FERRAZ NUNES DA SILVA,DANIEL FERRAZ NUNES DA SILVA,RUA DOM BOSCO,151,CENTRO,16400075,40636463,-739118
352710,126,SP,LINS,3924920,SIMONE APARECIDA BURANELLO,SIMONE APARECIDA BURANELLO,RUA PEDRO DE TOLEDO,151,CENTRO,16400075,,
355030,127,SP,SAO PAULO,3925056,CLINICA ODONTOLOGICA DEMARI E RODRIGUES,CLINICA ODONTOLOGICA DEMARI E RODRIGUES LTDA,,M,RUA SARGENTO PEDRO DOS SANTOS,43,40657413,-73983
355030,128,SP,SAO PAULO,3925196,CONS MEDICO SANDRO LUIZ PADIAL,SANDRO LUIZ PADIAL,RUA PADRE ESTEVAO PERNET,1059,TATUAPE,3315000,,
355030,129,SP,SAO PAULO,3925226,CONS MEDICO HAROLDO MEHLBERG,HAROLDO MEHLBERG,AV VEREADOR JOSE DINIZ,492,SANTO AMARO,4604000,,
355030,130,SP,SAO PAULO,3925250,CONS MEDICO VANDEBILT SERV MEDICOS,VANDEBILT SERVICOS MEDICOS LTDA,M,AL MINISTRO ROCHA AZEVEDO,882,JARDIM PAULISTA,,
355030,131,SP,SAO PAULO,3925269,CONS ODONTO EDGARD LAZARO DE SOUZA JR,EDGARD LAZARO DE SOUZA JUNIOR,R ANTONIO DAS CHAGAS,736,CHACARA SANTO ANTONI,4714001,,
355030,132,SP,SAO PAULO,3925323,CONS MEDICO ANA MARLENE GORZ REINHARD,CONSULTORIO ANA MARLENE GORZ REINHARD,RUA CINCINATO BRAGA,102,BELA VISTA,1333010,,
355030,133,SP,SAO PAULO,3925331,CLINICA MEDICA SALUTE,SALUTE CLINICA MEDICA LTDA,,M,RUA AUSONIA,519,,
355030,134,SP,SAO PAULO,3925390,CONS MEDICO UMI,UMI UNIDADE MATERNO INFANTIL LTDA,,M,RUA DA FIGUEIRA,831,,
354980,135,SP,SAO JOSE DO RIO PRETO,3925676,CIOM FONOAUDIOLOGIC,CELSO JOSE BENICHIO,RUA ELIAS ABISSANRA,250,JARDIM BORDON,15055420,,
350850,136,SP,CACAPAVA,3925838,CLINICA OFTALMOLOGICA RENATA NAPPO LTDA,CLINICA OFTALMOLOGICA RENATA NAPPO LTDA,,M,COMENDADOR JOAO LOPES,560,40644142,-73957924
352710,137,SP,LINS,3925870,CLINICA CORPO E ESSENCIA,CLINICA CORPO E ESSENCIA SOCIEDADE SIMPLES LTDA,,M,AV JOSE ARIANO RODRIGUES,154,,
351110,138,SP,CATANDUVA,3926400,MANUEL CASTRO LAHOZ CATANDUVA,MANUEL CASTRO LAHOZ,RUA BELEM,117,CENTRO,15801240,,
354340,139,SP,RIBEIRAO PRETO,3926435,LETICIA ZOEGA MACHADO,LETICIA ZOEGA MACHADO,RUA GALILEU GALILEI,1685,JARDIM IRAJA,14020620,40703403,-73917786
352920,140,SP,MARTINOPOLIS,3926605,CONSULTORIO MEDICO DR MAXIMILIANO GUZMAN ARISPE,MAXIMILIANO GUZMAN ARISPE,RUA JOSE HENRIQUE MELLO,284,CENTRO,19500000,40722343,-7377717
350600,141,SP,BAURU,3926613,PATRICIA DE GUADALUPE BARNES AUCELIO,PATRICIA DE GUADALUPE BARNES AUCELIO,RUA GUILHERME DE ALMEIDA,637,VILA CIDADE UNIVERSI,17050000,,
352710,142,SP,LINS,3926680,CLINICA LINENSE DE MEDICINA INTERNA LTDA,CLINICA LINENSE DE MEDICINA INTERNA LTDA,,M,AVENIDA NICOLAU ZARVOS,1650,40639256,-7400368
354850,143,SP,SANTOS,3374262,CLINICA DE GASTROENTEROLOGIA DR SUZUKI LTDA,CLINICA DE GASTROENTEROLOGIA DR SUZUKI LTDA,,M,AVENIDA DONA ANA COSTA,414,40758396,-7381994
354850,144,SP,SANTOS,3376400,URO CENTER,URO CENTER INSTUTO DE UROLOGIA DA BAIXADA SANTISTA LTDA,,M,RUA DOUTOR OLYNTHO RODRIGUES DANTAS,343,,
355030,145,SP,SAO PAULO,3378055,CLINICA AGUADE,CLINICA ENDOCRINOLOGIA DR LUIZ C M AGUADE LTDA,M,RUA ALFREDO GUEDES,72,SANTANA,,
355030,146,SP,SAO PAULO,3378128,CONS MEDICO JOEL SINGAL,JOEL SINGAL,RUA ISABEL,105,PENHA,3647020,,
353870,147,SP,PIRACICABA,3380955,INSTITUTO DE ONCOLOGIA DE PIRACICABA,INSTITUTO DE ONCOLOGIA CLINICA DE PIRACICABA SC LTDA,,M,AVENIDA INDEPENDENCIA,953,,
350330,148,SP,ARARAS,3383504,UNIDADE DE VIGILANCIA EPIDEMIOLOGICA ARARAS,MUNICIPIO DE ARARAS,M,RUA CAMPOS SALES,33,JARDIM BELVEDERE,,
355030,149,SP,SAO PAULO,3384160,CIONG CLINICA INTEGRADA DE OUVIDO NARIZ E GARGANTA,CIONG CLINICA INTEGRADA DE OUVIDO NARIZ E GARGANTA LTDA ME,RUA JORGE AUGUSTO,83,VILA CENTENARIO,3645000,4069407,-7382802
354850,150,SP,SANTOS,3384411,BOTURAO BOTURAO HEMATOLOGIA CLINICO LTDA,BOTURAO BOTURAO HEMATOLOGIA CLINICO LTDA,,M,AVENIDA DONA ANA COSTA,361,,
353870,151,SP,PIRACICABA,3892808,CONSULTORIO MEDICO DRA VIVIANE ZVEITER DE MORAES PIRACICABA,VIVIANE ZVEITER DE MORAES,AVENIDA CARLOS BOTELHO,595,SAO DIMAS,13416145,,
353870,152,SP,PIRACICABA,3892816,CONSULTORIO MEDICO DR ARAYR OLAIR FERRARI PIRACICABA,ARAYR OLAIR FERRARI,AVENIDA SAO JOAO,186,SAO JUDAS,13416382,,
351340,153,SP,CRUZEIRO,3892956,ELINE PUCCINI DE BRITO NOVAES SANTOS,ELINE PUCCINI DE BRITO NOVAES SANTOS,R DR CELESTINO,1565,CENTRO,12721000,,
350400,154,SP,ASSIS,5616999,DR ELYSEU,ELYSEU PALMAS BROUTOS,AVENIDA SEBASTIAO MENDES DE BRITO,1075,JARDIM EUROPA,19800100,,
355620,155,SP,VALINHOS,5617057,HELOISA GLEREAN GUIZELLI,HELOISA GLEREAN GUIZELLI,AV ONZE DE AGOSTO,2030,VILA CASSIA,13271170,,
355030,156,SP,SAO PAULO,5617448,CLINICA SOTIRIS,SOTIRIS CONSULTORIO DE OTORRINOLARINGOLOGIA E FONOAUDIOLOG,M,AVENIDA SARGENTO GERALDO SANTANA,280,JARDIM ITAPEVA,,
350950,157,SP,CAMPINAS,5617898,BENOAR PAIVA CIRURGIA PLASTICA,BENOAR PAIVA CIRURGIA PLASTICA,,M,RUA DOUTOR ALEXANDER FLEMING,784,40678236,-738975198
355710,158,SP,VOTUPORANGA,5618401,AME AMBULATORIO MEDICO DE ESPECIALIDADES DE VOTUPORANGA,SECRETARIA DE ESTADO DA SAUDE DE SAO PAULO,4,64E+13,E,RUA MARIA DE FREITAS LEITE,,
352390,159,SP,ITU,5618703,ASTRID DA ROS,ASTRID DA ROS,RUA ACRE,26,BRASIL,13301380,,
350600,160,SP,BAURU,3872408,MATEUS VIOLIN DA SILVA,MATEUS VIOLIN DA SILVA,RUA COMENDADOR JOSE DA SILVA MARTHA,330,JD ESTORIL,17012530,4073723,-74000656
350600,161,SP,BAURU,3872432,LAERTEL FERNANDES FASSONI,LAERTEL FERNANDES FASSONI,RUA DOUTOR OLIMPIO DE MACEDO,420,VILA CIDADE UNIVERSI,17012533,4077039,-7391771
355030,162,SP,SAO PAULO,3842371,CONS MEDICO LUIZ GUILHERME MARTINS CASTRO,LUIZ GUILHERME MARTINS CASTRO,R MATO GROSSO,306,HIGIENOPOLIS,1239040,,
353060,163,SP,MOGI DAS CRUZES,3842444,CLINICA MEDICA CEZAR CROZERA MOJI DAS CRUZES,CLINICA MEDICA CEZAR CROZERA SOCIEDADE SIMPLES LIMITADA,,M,BARAO DE JACEGUAI,1261,4075548,-7374173
353470,164,SP,OURINHOS,3842592,ALBERTO SCHULHAN,ALBERTO SCHULHAN,RUA SILVA JARDIM,768,VILA MORAES,19900261,4076434,-7387448
353430,165,SP,ORLANDIA,3842665,CONS ISOLADO JOSE ANTONIO MASSARO ORLANDIA,JOSE ANTONIO MASSARO,AVENIDA DOZE,195,CENTRO,14620000,,
355030,166,SP,SAO PAULO,3842819,CONS MEDICO ABRAHAO EMIDIO PEDREIRA DE ALBUQUERQUE,ABRAHAO EMIDIO PEDREIRA DE ALBUQUERQUE,RUA PADRE ESTEVAO PERNET,160,TATUAPE,3315000,,
355030,167,SP,SAO PAULO,3842827,CEDAC MEDICINA DIAGNOSTICA HUMANIZADA,CEDAC CENTRO DE DIAGNOSTICO E ANALISES CLINICAS LTDA ME,,M,RUA JOSE JANNARELLI,199,,
355030,168,SP,SAO PAULO,3842835,CLINICA MEDICA MONTE SINAI,CLINICA MEDICA MONTE SINAI SC LTDA,,M,AVENIDA ANGELICA,916,,
351880,169,SP,GUARULHOS,3843076,SECRETARIA MUNICIPAL DE SAUDE DE GUARULHOS,PREFEITURA MUNICIPAL DE GUARULHOS,M,RUA IRIS,320,GOPOUVA,407592665,-737503638
353800,170,SP,PINDAMONHANGABA,3843181,CLOVIS FERRER RIBEIRO PINDAMONHANGABA,CLOVIS FERRER RIBEIRO,AV CEL FERNANDO PRESTES,315,CENTRO,12400240,,
351110,171,SP,CATANDUVA,3843335,CLINICA MEDICA NARDI S C LTDA CATANDUVA,CLINICA MEDICA NARDI S C LTDA,,M,AVENIDA DEPUTADO ORLANDO ZANCANER,301,,
354880,172,SP,SAO CAETANO DO SUL,3843505,CONSULTORIO MEDICO TIOKI OGUSUKA,TIOKI OGUSUKA,R RIO DE JANEIRO,453,SANTA PAULA,9540400,,
354880,173,SP,SAO CAETANO DO SUL,3843521,CONSULTORIO ODONTOLOGICO PRISCILA KIBUNE TANAKA,PRISCILA KIBUNE TANAKA,RUA CAPIVARI,830,MAUA,9580370,407092,-739919
355030,174,SP,SAO PAULO,3843734,LABORATORIO ROBERTO DE PROTESE DENTAL,LABORATORIO ROBERTO DE PROTESE DENTAL SS,,M,RUA MESQUITA,133,40765854,-73914505
354990,175,SP,SAO JOSE DOS CAMPOS,3843785,ORTOVALE,CLINICA DE FRATURA ORTOVALE LTDA ME,,M,AV ADHEMAR DE BARROS,633,,
355480,176,SP,TREMEMBE,3843807,CONSULTORIO ODONTOLOGICO DRA SILVANA CROZARIOL TREMEMBE,SILVANA CROZARIOL,RUA JOSE INOCENCIO MONTEIRO,150,JD DOS EUCALIPTOS,12120000,,
354990,177,SP,SAO JOSE DOS CAMPOS,3843823,GERALDO FORTES BUSTAMANTE NETO,GERALDO FORTES BUSTAMANTE NETO,AVENIDA ADHEMAR DE BARROS,566,VILA ADYANNA,12245011,,
355410,178,SP,TAUBATE,3843858,CONSULT DE ONCO CIRURGICA E MASTOLOGIA DRA YASMIN TAUBATE,YASMIN SUKAIR,RUA DR SOUZA ALVES,365,CENTRO,12020030,407541077,-737232034
355410,179,SP,TAUBATE,3843874,CONS ODONTOLOGICO DRA TATIANA G G P DE REZENDE TAUBATE,TATIANA GOLDSMID GALVAO PROTA DE REZENDE,RUA MARQUES DO HERVAL,449,CENTRO,12080250,40855793,-7386986
355410,180,SP,TAUBATE,3843947,FONOCENTER TAUBATE,D P DO AMARAL M R L A MATHEUS LTDA,,M,AV JOHN FITZGERALD KENNEDY,1215,40766895,-73921394
355410,181,SP,TAUBATE,3843971,CONSULTORIO ODONTO ANA MARIA ARANHA DE SOUZA TAUBATE,ANA MARIA ARANHA DE SOUZA,RUA CLIBAS DE ALVARENGA,296,BONFIM,12040350,,
355410,182,SP,TAUBATE,3844013,CONSULTORIO ODONTOLOGICO ANA LUCIA ANDRAUS TAUBATE,ANA LUCIA ANDRAUS,AV JOHN F KENNEDY,881,JARDIM DAS NACOES,12030200,4061661,-73926636
355410,183,SP,TAUBATE,3844021,DORSF TAUBATE,DORSF RADIOLOGIA ODONTOLOGICA LTDA,,M,RUA VISCONDE DO RIO BRANCO,603,,
