IBGE,NUMERO,UF,MUNICIPIO,CNES,NOME FANTASIA,RAZAO SOCIAL,LOGRADOURO,NUMERO_1,BAIRRO,CEP,LATITUDE,LONGITUDE
352210,1354,SP,ITANHAEM,5330300,FLAVIO MARANI JUNIOR,FLAVIO MARANI JUNIOR,AVENIDA CONDESSA DE VIMIEIROS,470,CENTRO,11740000,4075781,-7397353
352680,1355,SP,LENCOIS PAULISTA,2038722,HEMOLABLENCOIS PAULISTA,HEMOLAB LABORATORIO DE ANALISES CLINICAS LTDA,,M,RUA GERALDO PEREIRA DE BARROS,157,4074544,-739754
355250,1356,SP,SUZANO,7082207,JOANIVALDA VIANA SOUSA,JOANIVALDA VIANA SOUSA,AVENIDA MOGI DAS CRUZES,91,PARQUE SUZANO,8673010,40635494,-7400957
355070,1357,SP,SAO SEBASTIAO,3505316,FERNANDA BERTINI,FERNANDA BERTINI,RUA DUQUE DE CAXIAS,188,CENTRO,11608545,40848038,-7393285
352470,1358,SP,JAGUARIUNA,5217423,DANIELA CRISTINA MAIA,DANIELA CRISTINA MAIA,RUA CORONEL AMANCIO BUENO,854,CENTRO,13910009,40750317,-7399112
354140,1359,SP,PRESIDENTE PRUDENTE,3850277,CONSULTORIO MEDICO MARCIO ROBERTO RODRIGUES,MARCIO ROBERTO RODRIGUES,AV WASHINGTON LUIZ,763,CENTRO,19015150,4070926,-7379739
354140,1360,SP,PRESIDENTE PRUDENTE,3871347,CONSULTORIO MEDICO DRA MARIA MARTHA S EUGENIO BARREIROS,MARIA MARTHA SANDOVAL EUGENIO BARREIROS,AV CEL JOSE SOARES MARCONDES,1078,CENTRO,19010080,40752403,-7392442
354850,1361,SP,SANTOS,2050064,UNIDADE DE SAUDE DA FAMILIA CARUARA,MUNICIPIO DE SANTOS,M,RUA ANDRADE SOARES,800,CARUARA,4065632,-7394931
351630,1362,SP,FRANCISCO MORATO,2083744,USF DO JARDIM ROSAS,SAMEFM SERVICO DE ASSISTENCIA MEDICA DE FRANCISCO MORATO,M,RUA VICTOR EUGENIO LIPPO,76,JD ROSAS,40668354,-7397933
354670,1363,SP,SANTA GERTRUDES,5020573,UBS PSF CATARINA CAETANO DEMARCHI DE SANTA GERTRUDES,PREFEITURA MUNICIPAL DE SANTA GERTRUDES,M,RUA OLAVO BASSO,535,JEQUITIBAS,40777504,-73954956
351550,1364,SP,FERNANDOPOLIS,5099838,FISIOTRAT FERNANDOPOLIS,JUNE FLAMARINI MIGLIORINI RODRIGUES CUNHA,AV MANOEL MARQUES ROSA,1001,CENTRO,15600016,4065699,-738849
353130,1365,SP,MONTE ALTO,4048814,PAMM ANA MARIA NACARATTO POPIM APARECIDA DE MONTE ALTO,MUNICIPIO DE MONTE ALTO,M,RUA JOAO LUIZ GONZAGA FILHO,334,CENTRO,40709866,-7396122
354140,1366,SP,PRESIDENTE PRUDENTE,5240514,CONSULTORIO NUTRICAO ELIANE CRISTINA SANCHES PRES PRUDENTE,ELIANE CRISTINA SANCHES,AV CORONEL JOSE SOARES MARCONDES,305,VILA MACHADINHO,19020120,40638046,-7392698
352410,1367,SP,ITUVERAVA,3822176,CRBI,CENTRO DE RADIOLOGIA BUCAL DE ITUVERAVA LTDA,M,RUA MARIA LIPORACI,224,CENTRO,40729794,-74002144
353010,1368,SP,MIRANDOPOLIS,2068818,FISIOTERAPIA CORPUS MIRANDOPOLIS,CLINICA DE FISIOTERAPIA CORPUS LTDA,,M,REGENTE FEIJO,541,4061143,-7403485
350530,1369,SP,BARRA BONITA,3730166,CONSULTORIO ODONTOLOGICO IZABEL ORTIGOSA CUNHA BARRA BONITA,IZABEL ORTIGOSA CUNHA,RUA PRUDENTE DE MORAES,1157,CENTRO,17340000,4072176,-7376001
355340,1370,SP,TANABI,3265404,MULTICLINICA TANABI,CLINICA DR FUAD LTDA,,M,RUA CAPITAO JERONIMO FORTUNATO,634,40743446,-7400355
354140,1371,SP,PRESIDENTE PRUDENTE,3180212,ECCO VITTA,ECCO VITTA DIAGNOSTICOS MEDICOS SC LTDA,,M,RUA SETE DE SETEMBRO,1409,40741932,-7379696
354140,1372,SP,PRESIDENTE PRUDENTE,2047071,FISIOCLINICA,FISIOCLINICA SS LTDA ME,,M,RUA DONA MILITANIA,2,40806164,-73909134
353130,1373,SP,MONTE ALTO,5349400,USF DR JOSE JESUS VICTORIO RODRIGUES MONTE ALTO,MUNICIPIO DE MONTE ALTO,M,RUA APRIGIO RIBEIRO GUIMARAES,161,JARDIM CANAA,40719215,-73742256
355070,1374,SP,SAO SEBASTIAO,3432947,CEAO,ARIOVALDO CAMILO CERQUEIRA,AVENIDA VEREADOR MARIO OLEGARIO LEITE,140,CENTRO,11606115,40709184,-73956815
351960,1375,SP,IBITINGA,3807525,BIOMED IBITINGA,BIOMED LABORATORIO DE ANALISES CLINICAS LTDA,,M,RUA XV DE NOVEMBRO,584,,
350160,1376,SP,AMERICANA,5212553,FABRICIA SIGNORELLI,FABRICIA SIGNORELLI,RUA ANTONIO FREZARIM,104,VILA MEDON,13465120,4075326,-7400383
355030,1377,SP,SAO PAULO,2787199,UBS J ARACATI,PREFEITURA DO MUNICIPIO DE SAO PAULO,M,RUA FRANCISCO HOMEM DE EL REI,87,JARDIM ARACATI,40858162,-7391699
353880,1378,SP,PIRAJU,2029480,POLICLINICA DR LUIZ FERREIRA PIRAJU,PREFEITURA MUNICIPAL DA ESTANCIA TURISTICA DE PIRAJU,M,RUA FERREIRA BONAMETTI,5,VILA LAINO,40722897,-7391386
354140,1379,SP,PRESIDENTE PRUDENTE,3200205,CLINICA E CIRURGIA DE OLHOS DR OMAR MURAD,CLINICA E CIRURGIA DE OLHOS DR OMAR MURAD LTDA,,M,AV WASHINGTON LUIZ,510,40823032,-7393808
353650,1380,SP,PAULINIA,3495922,UBS PARQUE DA REPRESA,PREFEITURA MUNICIPAL DE PAULINIA,M,RUA NELSON PERINI,398,BALNEARIO TROPICAL,40656708,-7400537
350610,1381,SP,BEBEDOURO,2022427,E S F DR JOAO CAMBAUVA,PREFEITURA MUNICIPAL DE BEBEDOURO,M,RUA ANTONIO PAGANELLI,129,JD AEROPORTO,40810997,-73905846
354140,1382,SP,PRESIDENTE PRUDENTE,3900746,CONSULTORIO MEDICO ANTONIO HIROSHI SAITO,ANTONIO HIROSHI SAITO,AV WASHINGTON LUIZ,2325,JARDIM PAULISTA,19023450,40607,-73999344
355540,1383,SP,UBATUBA,2070022,UBS DO TAQUARAL UBATUBA,PREFEITURA MUNICIPAL DA ESTANCIA BALNEARIA DE UBATUBA,M,RUA PRINCIPAL,S/N,TAQUARAL,40882435,-73879036
352250,1384,SP,ITAPEVI,5672457,ORAL CLASS,ORAL CLASS ODONTOLOGIA INTEGRADA LTDA,M,AMERICO VALENTIM CRISTIANINI,10,CENTRO,40753006,-738326
355070,1385,SP,SAO SEBASTIAO,5321174,TRANSPETRO,PETROBRAS TRANSPORTE S A,,M,AVENIDA GUARDA MOR LOBO VIANA,1111,40699707,-7395718
353670,1386,SP,PEDERNEIRAS,2791544,UNIDADE DE SAUDE DA FAMILIA ESTEVAN MATURANA,PREFEITURA MUNICIPAL DE PEDERNEIRAS,M,AVENIDA VEREADOR CATARINO DOS SANTOS,1617,LEONOR MENDES DE BAR,40689377,-73987045
354070,1387,SP,PORTO FERREIRA,3963683,CLINICA MEDICA LUIZ HENRIQUE PORTO FERREIRA,LUIZ HENRIQUE LEDESMA PEREIRA,RUA BENTO JOSE DE CARVALHO,525,CENTRO,13660055,,
353180,1388,SP,MONTE MOR,2059614,VIGILANCIA SANITARIA MUNICIPAL DE MONTE MOR SP,PREFEITURA MUNICIPAL DE MONTE MOR,M,R SIQUEIRA CAMPOS,241,CENTRO,40734978,-73862076
354140,1389,SP,PRESIDENTE PRUDENTE,3871363,CONSULTORIO MEDICO OILTON LIBERATI VIEIRA,OILTON LIBERATI VIEIRA,RUA DR GURGEL,102,CENTRO,19010020,40758537,-7384199
352680,1390,SP,LENCOIS PAULISTA,3618463,JOAO BOSCO DA SILVA,JOAO BOSCO DA SILVA,RUA GERALDO PEREIRA DE BARROS,350,CENTRO,18682043,40722828,-73988335
354140,1391,SP,PRESIDENTE PRUDENTE,5192854,ECOCENTER PRESIDENTE PRUDENTE,ECOCENTER DOPPLER ECOCARDIOGRAFIA S S LTDA,,M,AV WASHINGTON LUIZ,973,40804066,-7393267
354910,1392,SP,SAO JOAO DA BOA VISTA,5077850,ARIOSTO PEREIRA MILAN SAO JOAO DA BOA VISTA,ARIOSTO PEREIRA MILAN,RUA CEL ERNESTO DE OLIVEIRA,116,CENTRO,13873060,4073625,-73998314
354400,1393,SP,RIO DAS PEDRAS,2035103,AMBULATORIO DE ESPECIALIDADES RIO DAS PEDRAS,PREFEITURA MUNICIPAL DE RIO DAS PEDRAS,M,RUA ARADESCO BIANCHIM,89,SAO CRISTOVAO I,4072179,-7399986
352480,1394,SP,JALES,5713072,CLINICA OLIVEIRA JALES,MARLENE SANTOS DE OLIVEIRA,RUA 02,1987,CENTRO,15704192,40645657,-73902885
354140,1395,SP,PRESIDENTE PRUDENTE,3392163,NEUSA HATSUE NISHIYAMA ALVES,NEUSA HATSUE NISHIYAMA ALVES,RUA DR GURGEL,348,CENTRO,19010010,4062459,-7413656
354910,1396,SP,SAO JOAO DA BOA VISTA,5204526,ADEMIR MARTINS BOAVENTURA SAO JOAO DA BOA VISTA,ADEMIR MARTINS BOAVENTURA,RUA BERNARDINO DE CAMPOS,633,CENTRO,13870248,4080153,-739367
351960,1397,SP,IBITINGA,3813738,CLINICA MEDICA DECIO CUNHA VIANA FILHO IBITINGA,DECIO CUNHA VIANA FILHO,RUA DOMINGOS ROBERT,1227,CENTRO,14940064,40637215,-7393274
350070,1398,SP,AGUDOS,5290821,CONSULTORIO MEDICO MARIA VIRGINIA R RASSETTO AGUDOS,MARIA VIRGINIA RIBEIRO RASSETTO,RUA PREF DR ANTONIO CONDI,768,VILA ANDREOTTI,17120013,,
352410,1399,SP,ITUVERAVA,3851184,ANDREA HONORATO DAVID BARRACHI,ANDREA HONORATO DAVID BARRACHI,RUA CEL FRANCISCO JUNQUEIRA,419,CENTRO,14500000,4080777,-7394549
354140,1400,SP,PRESIDENTE PRUDENTE,2033909,APAE DE PRESIDENTE PRUDENTE,APAE ASSOCIACAO DE PAIS E AMIGOS DOS EXCEPCIONAIS P PRUDENTE,,M,RUA DAVID CERQUEIRA LEITE,261,4084231,-73937035
355100,1401,SP,SAO VICENTE,5347637,CESAR ALVES MALERBA SAO VICENTE,CESAR ALVES MALERBA,RUA BENJAMIN CONSTANT,61,CENTRO,11310500,40793613,-7384256
353440,1402,SP,OSASCO,5126592,SANTOS ANDRADE SERVICOS MEDICOS,SANTOS ANDRADE SERVICOS MEDICOS LTDA EPP,M,RUA DR ANTONIO JOSE LUCIANO,298,JD AGU,40737568,-7400975
354970,1403,SP,SAO JOSE DO RIO PARDO,3599388,RIOLAB SJRIOPARDO,RIOLAB SERVICOS LABORATORIAIS SC LTDA,M,AVENIDA INDEPENDENCIA,245,CENTRO,40797867,-7396758
354850,1404,SP,SANTOS,3395847,JOSE RUBENS AFONSO,JOSE RUBENS AFONSO,AVENIDA ALMIRANTE COCHRANE,238,MACUCO,11040002,40630512,-73957306
353650,1405,SP,PAULINIA,2065207,SERVICO DE SAUDE MENTAL INFANTIL E ADOLESCENTES PAULINA,PREFEITURA MUNICIPAL DE PAULINIA,M,RUA BRIG FARIA LIMA,43,JARDIM DOS CALEGARIS,4074975,-7375485
350380,1406,SP,ARTUR NOGUEIRA,2042495,ESPACO MAE E FILHO ARTUR NOGUEIRA,PREFEITURA MUNICIPAL DE ARTUR NOGUEIRA,M,AVENIDA 15 DE NOVEMBRO,1555,JARDIM PLANALTO,4065067,-7395248
352220,1407,SP,ITAPECERICA DA SERRA,3654192,CENTRO DE DETENCAO PROVISORIA DE ITAPECERICA DA SERRA,SECRETARIA DA ADMINISTRACAO PENITENCIARIA DE SAO PAULO,9,63E+13,M,ESTR FERREIRA GUEDES,40844685,-7391451
352710,1408,SP,LINS,3633926,SORRILINS CLINICA ODONTOLOGICA,SORRILINS CLINICA ODONTOLOGICA LTDA,,M,RUA PEDRO DE TOLEDO,900,40728302,-738549
354980,1409,SP,SAO JOSE DO RIO PRETO,3726487,CLINICA DE HOMEOPATIA SIMILLIMUM,MILENY CRISTINA XAVIER,RUA RAUL SILVA,1366,NOVA REDENTORA,15090035,4080576,-73944786
354160,1410,SP,PROMISSAO,3990281,CLINICA SAO PAULO PROMISSAO,CLINICA SAO PAULO DE PROMISSAO SERVICOS MEDICOS S C LTDA,,M,PRACA 9 DE JULHO,191,4070263,-7393417
354140,1411,SP,PRESIDENTE PRUDENTE,5040175,CONSULTORIO MEDICO MANOEL CESAR CAMARA OLIVEIRA,MANOEL CESAR DA CAMARA OLIVEIRA,RUA TENENTE NICOLAU MAFFEI,1989,VILA SANTA HELENA,19015021,4064739,-739694
354940,1412,SP,SAO JOAQUIM DA BARRA,3789799,CONSULTORIO ODONTOLOGICA GUSTAVO ROCHA TASINAFO,GUSTAVO ROCHA TASINAFO,RUA RIO DE JANEIRO,370,CENTRO,14600000,40646786,-74008575
354060,1413,SP,PORTO FELIZ,2059452,PSF AGRO VILA CAIC JOSE BERNARDINO PORTO FELIZ,PREFEITURA MUNICIPAL DE PORTO FELIZ,M,ZONA RURAL,S/N,INDAIATUBA,40622402,-7416794
354140,1414,SP,PRESIDENTE PRUDENTE,3973573,CONSULTORIO MEDICO GABRIEL BENTO JUNQUEIRA,GABRIEL BENTO JUNQUEIRA,AV WASHINGTONN LUIZ,864,CENTRO,19015050,4068749,-738334
355210,1415,SP,SOCORRO,2034077,PAS CHAVE POSTINHO CHAVE DE SOCORRO,PREFEITURA MUNICIPAL DE SOCORRO,M,ESTRADA SOCORRO MONTE ALEGRE,S/N,CHAVE,40749283,-73756645
351550,1416,SP,FERNANDOPOLIS,3735885,CONS MED HUMBERTO REGIS DE P FALEIROS FERNANDOPOLIS,HUMBERTO REGIS DE PAULA FALEIROS,RUA CERQUEIRA CESAR,451,JD AMERICA,15607024,40784122,-7397261
351770,1417,SP,GUARA,2077086,PSF VILA MATARAZZO,PREFEITURA MUNICIPAL DE GUARA,M,RUA CONDE FRANCISCO MATARAZZO,2635,VILA MATARAZZO,40678272,-73944626
350400,1418,SP,ASSIS,2057352,ESF JARDIM ELDORADO,PREFEITURA MUNICIPAL DE ASSIS,M,RUA ENIO MARCHESINI,108,NOVA ASSIS,4064937,-74012955
350950,1419,SP,CAMPINAS,2022842,CENTRO DE SAUDE INTEGRACAO,PREFEITURA MUNICIPAL DE CAMPINAS,M,R ZOCCA,161,V CASTELO BRANCO,40816875,-73916405
354770,1420,SP,SANTO ANASTACIO,2751046,SANTA CASA DE SANTO ANASTACIO,IRMANDADE DO HOSPITAL DE CARIDADE ANITA COSTA,,M,PRACA DOUTOR LUIS RAMOS E SILVA,328,40877846,-7390757
352260,1421,SP,ITAPIRA,2033666,POSTO DE SAUDE DA FAMILIA BARAO ATALIBA NOGUEIRA,PREFEITURA MUNICIPAL DE ITAPIRA,M,RUA LUIS FRASSETO,S/N,BARAO,40755955,-73881516
353930,1422,SP,PIRASSUNUNGA,3989348,MARIA APARECIDA MORSELLI RAMALHO PIRASSUNUNGA,MARIA APARECIDA MORSELLI RAMALHO PIRASSUNUNGA,RUA XV DE NOVEMBRO,1080,CENTRO,13630010,40752846,-7386425
354150,1423,SP,PRESIDENTE VENCESLAU,3068765,CLINICA DE MULTIVACINACAO,REGIS JORGE,RUA DJALMA DUTRA,12,CENTRO,19400000,4072634,-7376508
351880,1424,SP,GUARULHOS,2040077,UBS CUMMINS,PREFEITURA MUNICIPAL DE GUARULHOS,M,RUA PLACIDO IVO DE MELLO,68,CIDADE JARDIM CUMBIC,4066561,-7373568
350275,1425,SP,ARACARIGUAMA,2059444,CENTRO DE SAUDE MUNICIPAL ARACARIGUAMA,PREFEITURA MUNICIPAL DE ARACARIGUAMA,M,ALAMEDA BARUERI,61,JARDIM BRASIL,40668495,-73925606
353730,1426,SP,PENAPOLIS,5654637,UBS SILVIA COVAS,PREFEITURA MUNICIPAL DE PENAPOLIS,M,RUA DAS ORQUIDEAS,410,CONJUNTO HABITACIONA,4074639,-73977646
354140,1427,SP,PRESIDENTE PRUDENTE,2051133,ESF VILA MARCONDES DR JOSE CUPERTINO D ARCE,MUNICIPIO DE PRESIDENTE PRUDENTE,M,RUA BAHIA,454,VILA MARCONDES,40830635,-7385507
354130,1428,SP,PRESIDENTE EPITACIO,2750732,ESF VILA PORTO TIBIRICA,PREFEITURA MUNICIPAL DA EST TURISTICA DE PRESIDENTE EPITACIO,M,AVENIDA TIBIRICA,510,PORTO TIBIRICA,40768803,-73952324
354530,1429,SP,SALTO DE PIRAPORA,2055651,PSF BARRA,MUNICIPIO DE SALTO DE PIRAPORA,M,ZONA RURAL,S/N,BARRA,40830986,-7391139
355670,1430,SP,VINHEDO,3140040,CARLOS OLEGARIO DIAS,CARLOS OLEGRIO DIAS,RUA DR ANESIO A DO AMARAL,190,JARDIM SANTA ROSA,13280001,40704494,-7381743
353890,1431,SP,PIRAJUI,5448956,CONSULTORIO MEDICO JOSE AUGUSTO FARINA WICHER PIRAJUI,JOSE AUGUSTO FARINA WICHER,RUA VOLUNTARIO BENEDITO PIMENTA,240,CENTRO,16600041,408283,-7388296
353650,1432,SP,PAULINIA,5161126,SUELI APARECIDA CALMAN,SUELI APARECIDA CALMAN,RUA SALVADOR LOMBARDI NETO,439,NOVA PAULINIA,13140284,40672886,-7399922
352690,1433,SP,LIMEIRA,3462676,SANDRA MADURO DE CAMPOS LIMEIRA,SANDRA MADURO DE CAMPOS,RUA HERMINIA ALIBERTI,50,JARDIM BOA VISTA,13486130,40757107,-73997314
352510,1434,SP,JARDINOPOLIS,2040654,UBS AUGUSTO MARIA LELE JARDINOPOLIS,PREFEITURA MUNICIPAL DE JARDINOPOLIS,M,AV PEQUENA NO NASCIMENTO,S/N,BOM JESUS,40740562,-7380928
354630,1435,SP,SANTA CRUZ DAS PALMEIRAS,3363643,LABMED LABORATORIO DE ANALISES CLINICAS S C PALMEIRAS,OLIVEIRA OLIVEIRA ANALISES CLINICAS LTDA,,M,AVENIDA XV NOVEMBRO,964,,
354330,1436,SP,RIBEIRAO PIRES,3536807,INSTIT MEDIC AVANC DR CARMEN ADELAIDE BAPTISTA SC LTDA,INSTIT MEDIC AVANC DR CARMEN ADELAIDE BAPTISTA SC LTDA,M,RUA OLIMPIA CATA PRETA,169,CENTRO ALTO,40674664,-7397025
354990,1437,SP,SAO JOSE DOS CAMPOS,3708608,UPA EUGENIO DE MELO,PREFEITURA MUNICIPAL DE SAO JOSE DOS CAMPOS,M,RUA CORONEL EUGENIO AUGUSTO DE MELO,101,EUGENIO DE MELO,40583874,-73823044
354870,1438,SP,SAO BERNARDO DO CAMPO,3515648,ARNONI ASSISTENCIA ODONTOLOGICA,ARNONI ASSISTENCIA ODONTOLOGICA SS LTDA,,M,RUA ALFERES BONILHA,101,4068391,-7384583
354970,1439,SP,SAO JOSE DO RIO PARDO,2785161,LABORATORIO SAO LUCAS SJRIOPARDO,CLINICA E PATOLOGIA SAO LUCAS LTDA EPP,,M,AV INDEPENDENCIA,245,4067043,-73928185
350610,1440,SP,BEBEDOURO,2047381,E S F DR SALIM BONEMER FILHO,PREFEITURA MUNICIPAL DE BEBEDOURO,M,AVENIDA BELMIRO DIAS BAPTISTA,1201,JARDIM SOUZA LIMA,40861862,-7391282
353190,1441,SP,MORRO AGUDO,2057840,ESF II NILSON DE PAULA CARVALHO EQUIP SAUDE BUCAL ESB,PREFEITURA MUNICIPAL DE MORRO AGUDO,M,AV DR JADER MAGALHAES LARA FERNANDES,255,JARDIM DOS SILVEIRA,40742474,-7395277
353880,1442,SP,PIRAJU,5299063,CONSULTORIO DR ROBERTO,ROBERTO RIZZO SAMPAIO,RUA ESTEVES KRISTENSEN,85,JARDIM JURUMIRIM,18800358,40831978,-7393515
354140,1443,SP,PRESIDENTE PRUDENTE,2062828,ESF VILA NOVA PRUDENTE DR ANTONIO FAUCZ,MUNICIPIO DE PRESIDENTE PRUDENTE,M,RUA MANOEL DIAS PIMENTEL JUNIOR,15,VILA NOVA PRUDENTE,40739426,-7388079
354140,1444,SP,PRESIDENTE PRUDENTE,5095700,UNOFISIO,MORENO MACHADO S S LTDA,,M,RUA GABRIEL OTAVIO DE SOUZA,489,,
354530,1445,SP,SALTO DE PIRAPORA,2059525,PSF PAULISTANO,MUNICIPIO DE SALTO DE PIRAPORA,M,RUA LUIZ CARLOS DE ABREU,200,JD PAULISTANO,4072136,-73837036
354220,1446,SP,RANCHARIA,5230012,CONSULTORIO MEDICO ROBERTO PEREIRA CASSIANO RANCHARIA,ROBERTO PEREIRA CASSIANO,RUA MARIO CESAR DE CAMARGO,1578,VILA CANTIZANI,19600000,4073438,-7381478
354990,1447,SP,SAO JOSE DOS CAMPOS,5104211,ANGELA QUEIROZ VENEZIANI,ANGELA QUEIROZ VENEZIANI,RUA MAESTRO EGIDIO PINTO,165,JARDIM SAO DIMAS,12245190,40759884,-739368
353730,1448,SP,PENAPOLIS,2041219,UBS CIDADE JARDIM,PREFEITURA MUNICIPAL DE PENAPOLIS,M,AVENIDA ROMUALDO GAETTI,265,CIDADE JARDIM,40690308,-7399881
354140,1449,SP,PRESIDENTE PRUDENTE,5274532,CONSULTORIO MEDICO ANGELA MARIA FONTOURA JEHA PERUQUE,ANGELA MARIA FONTOURA JEHA PERUQUE,RUA FRANCISCO MORATO DE OLIVEIRA,53,JARDIM PAULISTA,19023080,4077759,-739591
355070,1450,SP,SAO SEBASTIAO,3425061,PAULO EDUARDO LANDE DOS SANTOS,PAULO EDUARDO LANDE DOS SANTOS,RUA PREFEITO MANSUETO PIEROTTI,494,CENTRO,11609003,4085206,-7382664
354150,1451,SP,PRESIDENTE VENCESLAU,2042789,ESF VILA SUMARE,PREFEITURA MUNICIPAL DE PRESIDENTE VENCESLAU,M,RUA PRESTES MAIA,522,VILA SUMARE,,
353910,1452,SP,PIRAPORA DO BOM JESUS,3211665,PSF DRA CELIA MARIA BRITO SALGADO,PREFEITURA MUNICIPAL DE PIRAPORA DO BOM JESUS,M,RUA CECILIA MEIRELLES,10,VILA NOVA,4075355,-7398505
352410,1453,SP,ITUVERAVA,5257492,EDMUNDO LUIZ MARSICO,EDMUNDO LUIZ MARSICO,RUA MARIA LIPORACI,420,CENTRO,14500000,4069364,-73982956
353440,1454,SP,OSASCO,5190835,HD CIRURGIOES,HD CIRURGIOES LTDA,,M,RUA JOAO COLINO,203,,
352230,1455,SP,ITAPETININGA,2047233,USF DR EDGAR PINTO VALLADA GRAMADINHO,PREFEITURA MUNICIPAL DE ITAPETININGA,M,RUA HERMINIA DE FREITAS,92,GRAMADINHO,407445,-73821815
354140,1456,SP,PRESIDENTE PRUDENTE,5274451,CONSULTORIO ODONTOLOGICO MARCIA CRISTINA FEDATO,MARCIA CRISTINA FEDATO,RUA DR GURGEL,485,CENTRO,19010020,,
354070,1457,SP,PORTO FERREIRA,2747251,USF IRACEMA MARIA AMELIA PERONDI,PREFEITURA MUNICIPAL DE PORTO FERREIRA,M,RUA NELSON P LOPES,521,CENTRO,4059192,-73801506
350570,1458,SP,BARUERI,5004276,CAPS II ESTACAO,PREFEITURA MUNICIPAL DE BARUERI,M,RUA JOSE MARIA BALIEIRO,715,CENTRO CENTRO COME,40765354,-7381733
353440,1459,SP,OSASCO,2054361,LABORATORIO DE ANALISES CLINICAS CRUZEIRO DO SUL,LABORATORIO DE ANALISES CLINICAS CRUZEIRO DO SUL,,M,RUA ELOY CANDIDO LOPES,200,4068804,-73947754
355340,1460,SP,TANABI,2076004,ESF DR FRANCISCO ASSIS SANTANA,PREFEITURA MUNICIPAL DE TANABI,M,RUA POLENICE CELERI,264,CENTRO,4076229,-7375711
354150,1461,SP,PRESIDENTE VENCESLAU,2042762,ESF VILA LUIZA,PREFEITURA MUNICIPAL DE PRESIDENTE VENCESLAU,M,RUA CANDIDO DE ALMEIDA,205,VILA LUIZA,40690907,-7395542
353930,1462,SP,PIRASSUNUNGA,5350735,MARIA LUIZA BRAGA FERNANDES PIRASSUNUNGA,MARIA LUIZA BRAGA FERNANDES PIRASSUNUNGA,RUA XV DE NOVEMBRO,1254,CENTRO,13630140,40765102,-7391291
354980,1463,SP,SAO JOSE DO RIO PRETO,3850757,UBSF CIDADE JARDIM,PREFEITURA MUNICIPAL DE SAO JOSE DO RIO PRETO,M,AVENIDA LOTF JOAO BASSITT,1900,CIDADE JARDIM,4061938,-7398289
350950,1464,SP,CAMPINAS,5263921,CLINICA OTORRINOLARINGOLOGIA E CIR BUCO MAXILO FACIAIS LTDA,CLINICA OTORRINOLARINGOLOGIA E CIR BUCO MAXILO FACIAIS LTDA,,M,RUA BARATA RIBEIRO,79,40630516,-74139565
351040,1465,SP,CAPIVARI,2785315,CENTRO DE SAUDE DR MARIO DIAS DE AGUIAR CAPIVARI,PREFEITURA MUNICIPAL DE CAPIVARI,M,RUA PADRE AROLDO,553,CENTRO,4072994,-7374481
354140,1466,SP,PRESIDENTE PRUDENTE,3002519,IMAGE CENTER CENTRO RADIOLOGICO DA MULHER,IMAGEM MEDICINA DIAGNOSTICA S S LTDA,M,AVENIDA CEL JOSE SOARES MARCONDES,276,VILA MARISTELA,40688904,-73980934
350280,1467,SP,ARACATUBA,2067951,CENTRO DE REPRODUCAO HUMANA DE ARACATUBA,CENTRO DE REPRODUCAO HUMANA DE ARACATUBA SC LTDA,,M,RUA TABAJARAS,783,40694107,-7389737
354150,1468,SP,PRESIDENTE VENCESLAU,4002571,CARLOS LUIZ DALLE JUNIOR,CARLOS LUIZ DALLE JUNIOR,AVENIDA DOM PEDRO II,805,CENTRO,19400000,4087518,-7386705
354140,1469,SP,PRESIDENTE PRUDENTE,3422747,OSCAR HARUO HIGA,OSCAR HARUO HIGA,JOSE DIAS CINTRA,18,VILA OCIDENTAL,19015050,4083887,-7387811
350840,1470,SP,CABREUVA,2079313,HOSPITAL SAO ROQUE CABREUVA,SANTA CASA DE MISERICORDIA DE CABREUVA,,M,PRC COMENDADOR MARTINS,S/N,4075898,-7399595
353670,1471,SP,PEDERNEIRAS,5856027,UNIDADE DE SAUDE DA FAMILIA WALDOMIRO FERNANDES MATEUS,PREFEITURA MUNICIPAL DE PEDERNEIRAS,M,AVENIDA JOSEPHINA LORENZETTI,1055,ANTONIO DE CONTI,406491,-7394649
354140,1472,SP,PRESIDENTE PRUDENTE,3392465,SIMAO DA SILVA BASTOS NETO,SIMAO DA SILVA BASTOS NETO,AV WASHINGTON LUIZ,1230,VL ESTADIO,19015150,40774906,-7397692
350190,1473,SP,AMPARO,2066599,USF JARDIM SAO DIMAS,MUNICIPIO DE AMPARO,M,RUA JOSE BUENO DE GODOI,31,JARDIM MODELO,40829,-7383642
354400,1474,SP,RIO DAS PEDRAS,3632202,RODRIGO GIOVANI CAMARGO DE RIO DAS PEDRAS,RODRIGO GIOVANI CAMARGO,RUA MONSENHOR GALLO,153,CENTRO,13390000,40649517,-7400101
354140,1475,SP,PRESIDENTE PRUDENTE,3979296,CONSULTORIO MEDICO SUELY FEIJO BROVINI MARCONDES,SUELY FEIJO BROVINI MARCONDES,RUA WENCESLAU BRAZ,212,VILA EUCLIDES,19014030,,
354850,1476,SP,SANTOS,5448794,SILVIA HELENA GERDULLI,SILVIA HELENA GERDULLI,RUA MARECHAL DEODORO DA FONSECA,5,GONZAGA,11060000,4080939,-7388042
350650,1477,SP,BIRIGUI,2072572,AMBULATORIO DE SAUDE MENTAL DR ARTUR CORDEIRO,PREFEITURA MUNICIPAL DE BIRIGUI,M,AV JOAO CERNACK,2360,VILA TRONCOSO,40666637,-737646
355100,1478,SP,SAO VICENTE,3021394,UNIDADE BASICA DE SAUDE SAMBAIATUBA SAO VICENTE,MUNICIPIO DE SAO VICENTE,M,PRACA DOM BOSCO,S/N,JOCKEY CLUB,4071483,-7381635
351960,1479,SP,IBITINGA,3812472,CLINICA ODONTOLOGICA ANTONIO JOSE COSTA FERREIRA,ANTONIO JOSE COSTA FERREIRA,RUA DOMINGOS ROBERT,777,CENTRO,14940133,40844833,-73909386
352920,1480,SP,MARTINOPOLIS,2750570,LABORATORIO ANALISES CLINICAS YAMAMOTO MARTINOPOLIS,YAMAMOTO SC LTDA,,M,AVN PADRE JOAO SCHNEIDER,316,4078168,-7384686
350750,1481,SP,BOTUCATU,3549968,CLINICA DE TERAPIA OCUPACIONAL SANDRA R MARQUES BOTUCATU,SANDRA REGINA MARQUES,RUA DOUTOR DARWIN DO AMARAL VIEGAS,298,JARDIM BOM PASTOR,18607680,40858288,-73866585
354430,1482,SP,ROSEIRA,2079046,UNIDADE MISTA DE SAUDE DE ROSEIRA DR PAULO GUIMARAES CASTRO,PREFEITURA MUNICIPAL DE ROSEIRA,M,RUA DUQUE DE CAXIAS,S/N,CENTRO,4065701,-7392212
355030,1483,SP,SAO PAULO,3493784,SUORT SUMARE ORTOPEDIA E TRAUMATOLOGIA,SUORT SUMARE ORTOPEDIA E TRAUMATOLOGIA S C LTDA,,M,RUA CAYOWAA,2066,40733337,-73983185
354980,1484,SP,SAO JOSE DO RIO PRETO,5447445,CLINICA ALMEIDA PRADO,ALMEIDA PRADO BARBOSA S S LTDA ME,,M,AVENIDA BENEDITO RODRIGUES LISBOA,2455,,
354260,1485,SP,REGISTRO,3195201,USF VILA SAO FRANCISCO REGISTRO,PREFEITURA MUNICIPAL DE REGISTRO,M,RUA JERONIMO MONTEIRO LOPES,658,VILA SAO FRANCISCO,407136,-740091
350750,1486,SP,BOTUCATU,5237734,PSICOLOGIA ALAIDE ESPINHEL DE JESUS BOTUCATU,ALAIDE ESPINHEL DE JESUS,RUA MONSENHOR FERRARI,380,CENTRO,18600310,4071419,-7394807
354260,1487,SP,REGISTRO,3606597,ALCEU HIDEHARU TABUTI CONSULTORIO MEDICO REGISTRO,ALCEU HIDEHARU TABUTI,RUA MERALDO PREVIDI,420,CENTRO,11900000,40773052,-7396241
355100,1488,SP,SAO VICENTE,2080710,HOSPITAL ANA COSTA SAO VICENTE,HOSPITAL ANA COSTA S A,,M,AV MARECHAL CANDIDO MARIANO DA SILVA RONDON,155,407968,-73929375
352590,1489,SP,JUNDIAI,2095777,CAPS III SEM FRONTEIRAS,CAPS CENTRO DE ATENCAO PSICOSSOCIAL III,M,R DR RAMIRO DE ARAUJO FILHO,234,VL HORTOLANDIA,,
350320,1490,SP,ARARAQUARA,2070790,CEAMA ARARAQUARA,INSTITUTO DE ASSISTENCIA TECNICA AO SERVIDOR PUBLICO ESTADUA,M,AV PRUDENTE DE MORAIS,286,CENTRO,40630264,-73897446
354070,1491,SP,PORTO FERREIRA,2747537,USF ELZA FALCO PASCHOANELLI,PREFEITURA MUNICIPAL DE PORTO FERREIRA,M,RUA MARIA A ABORELLI,140,JARDIM ANESIA,40743164,-7398564
351550,1492,SP,FERNANDOPOLIS,3694771,CONS ODONT NIDIA MARIA DE G S LAZARI FERNANDOPOLIS,NIDIA MARIA DE GODOY SOARES DE LAZARI,AV MANOEL MARQUES ROSA,1036,CENTRO,15603003,40702957,-7374332
352400,1493,SP,ITUPEVA,2028131,UBS DO BAIRRO MEDEIROS,PREFEITURA MUNICIPAL DE ITUPEVA,M,RUA ESTRADA DAS PAINEIRAS,1247,MEDEIROS,40821003,-7389787
354150,1494,SP,PRESIDENTE VENCESLAU,2065088,ATIVA FISIOCENTER PRESIDENTE VENCESLAU,ATIVA FISIOCENTER SC LTDA,,M,AVENIDA DOM PEDRO II,725,40708843,-7400251
351350,1495,SP,CUBATAO,3685837,LIVIA FACCA DE ANDRADE,LIVIA FACCA DE ANDRADE,RUA SAO PAULO,206,JD STA TEREZA,11500020,40804066,-7393117
350840,1496,SP,CABREUVA,2042436,USF BANANAL DR DARIO MORI ROMANI,PREFEITURA MUNICIPAL DE CABREUVA,M,AVENIDA HENRIQUE SORIO,413,BANANAL,4055231,-7419095
354260,1497,SP,REGISTRO,2042207,USF AGROCHA REGISTRO,PREFEITURA MUNICIPAL DE REGISTRO,M,RUA H,10,AGROCHA,4077719,-7395225
353440,1498,SP,OSASCO,5126657,CLINICA CAMPESINA,DR JORGE ALBERTO DOMINGO GARCIA FERRAZ LTDA,,M,AVN DR CARLOS DE MORAES BARROS,266,40602802,-7374879
354140,1499,SP,PRESIDENTE PRUDENTE,5103401,UNOFISIO,OESTE FISIO SERVICOS DE FISIOTERAPIA LTDA,,M,RUA GABRIEL OTAVIO DE SOUZA,489,4082802,-7393122
350330,1500,SP,ARARAS,5053293,UPA ELISA S FRANCHOZZA ARARAS,MUNICIPIO DE ARARAS,M,AVENIDA IRINEU CARROCCI,400,JOSE OMETTO II,40846466,-7387123
353060,1501,SP,MOGI DAS CRUZES,2773392,UBS BRAZ CUBAS,PREFEITURA MUNICIPAL DE MOGI DAS CRUZES,M,RUA PADRE ALVARO QUIRNONES ZUNIGA,340,BRAS CUBAS,40743916,-7392519
352590,1502,SP,JUNDIAI,3944026,CONSULTORIO MEDICO EDMUR DE TOLEDO PIZA FILHO,EDMUR DE TOLEDO PIZA FILHO,RUA ADEMIR PEREIRA DE BARROS,21,VL BOAVENTURA,13201796,40748047,-7382601
354140,1503,SP,PRESIDENTE PRUDENTE,3847306,SES SP DEPARTAMENTO REGIONAL DE SAUDE 11 PRES PRUDENTE,SECRETARIA DE ESTADO DA SAUDE DE SAO PAULO,E,AV CEL JOSE SOARES MARCONDES,2357,VILA ROBERTO,4086939,-7384997
354140,1504,SP,PRESIDENTE PRUDENTE,5040094,EMAL CLINICA MEDICA,EMAL CLINICA MEDICA DE PRESIDENTE PRUDENTE S S LTDA,,M,RUA DONATO ARMELIN,482,40633232,-7401192
355160,1505,SP,SERRA NEGRA,3807568,EKOS FISIOTERAPIA E FONOAUDIOLOGIA SERRA NEGRA,SERVICOS DE FISIOTERAPIA E FONOAUDIOLOGIA LTDA,,M,RUA PADRE JOAO BATISTA LAVELLO,107,40850426,-7394679
350750,1506,SP,BOTUCATU,3469972,FARMACIA MEDEX DRS VI BAURU BOTUCATU,SECRETARIA DE ESTADO DA SAUDE DE SAO PAULO,E,DISTRITO DE RUBIAO JUNIOR,S/N,RUBIAO JUNIOR,40612926,-7398243
350450,1507,SP,AVARE,5202027,CONSULTORIO ISOLADO ALDO JOSE LANCAS LUCHESI,ALDO JOSE LANCAS LUCHESI,RUA SAO CRISTOVAO,1080,VILA SAO JUDAS TADEU,18705470,40576347,-73967316
355620,1508,SP,VALINHOS,3544184,EDISON JALBUT,EDISON JALBUT,RUA ANA LEONISIA DO AMARAL CAMARGO,131,CENTRO,13270150,40777473,-7398884
354800,1509,SP,SANTO ANTONIO DE POSSE,2076284,UNIDADE DE SAUDE DA FAMILIA DR JOSE PAULO MARUM,PREFEITURA MUNICIPAL DE SANTO ANTONIO DE POSSE,M,PRACA CAPITAO PEDRO ANTONIO DE MORAES,175,RESSACA,40635372,-73988174
354990,1510,SP,SAO JOSE DOS CAMPOS,9229,UBS JARDIM ORIENTE,PREFEITURA MUNICIPAL DE SAO JOSE DOS CAMPOS,M,RUA SENJU OTA,40,JARDIM ORIENTE,40841652,-7387233
354730,1511,SP,SANTANA DE PARNAIBA,3005178,CAPS INFANTIL ESPACO DE VIDA,PREFEITURA MUNICIPAL DE SANTANA DE PARNAIBA,M,AV DR ALVARO RIBEIRO,610,JD FREDIANE,407606,-7396434
354140,1512,SP,PRESIDENTE PRUDENTE,5040558,CONSULTORIO MEDICO RENATA MARIA BOTTINO VIZZOTTO,RENATA MARIA BOTTINO VIZZOTTO,RUA SETE DE SETEMBRO,1409,VILA ESTADIO,19015090,40890545,-7384087
